{
  "$schema": "./uhd-taxonomy.schema.json",
  "id": "uhd",
  "version": "1.0.0",
  "description": "The UHD category taxonomy: a tree of hardware categories addressed by dotted paths of node ids (sensor.distance, actuator.motor.servo). A ModuleDef lists the paths it belongs to in `categories`, at any depth; consumers derive the ancestor paths for subtree filtering. Libraries extend it with nodes under their own x-<library> root (docs/taxonomy.md).",
  "delimiter": ".",
  "provenance": {
    "derivedFrom": {
      "name": "ProtoPart category taxonomy",
      "version": "2.1.0",
      "publisher": "Delta Robotics, Inc.",
      "nodes": 77
    },
    "notes": [
      "Every path of ProtoPart taxonomy 2.1.0 exists here with the same id, so a part categorised against 2.1.0 is valid against 1.0.0 unchanged.",
      "Names and descriptions were reviewed for hardware in general rather than one parts library: roots and nodes that read as one catalogue's sections were widened (microcontroller covers chips, modules and single-board computers; component.display covers OLED and TFT modules; actuator.motor_controller names ESCs).",
      "Nodes added for hardware the source did not cover: microcontroller.chip, .module, .single_board_computer, .flight_controller; sensor.gnss, .magnetic, .force; actuator.haptic, .solenoid; power.monitor, .distribution; connectivity.wireless.video; robotics.drone; mechanical.seal, .enclosure, .motion, .hydraulic, .fastener.screw, .fastener.nut, .fastener.insert; connector.usb, .rf; component.passive.ferrite_bead, .crystal; component.protection, component.relay.",
      "The kit node keeps its SKU and vendor. The source's controller_part_id and manifest fields pointed into ProtoPart's own library and contribution folder, so they are not carried; a library that holds a kit's manifest states it in its own extension (docs/taxonomy.md).",
      "Agent notes that named one application's tools were reworded to be tool-neutral."
    ]
  },
  "categories": {
    "microcontroller": {
      "name": "Microcontrollers and Computers",
      "description": "Microcontroller chips, modules and development boards, flight controllers and single-board computers",
      "children": {
        "chip": {
          "name": "Microcontroller Chips",
          "description": "Bare microcontroller and wireless SoC chips, placed on a board with their supporting parts"
        },
        "module": {
          "name": "MCU and Radio Modules",
          "description": "Shielded, often certified modules (chip, flash, crystal, antenna) soldered onto a carrier board by castellations or LGA pads"
        },
        "development_board": {
          "name": "Development Boards",
          "description": "Development boards from other makers, or not tied to one board family"
        },
        "single_board_computer": {
          "name": "Single-Board Computers",
          "description": "Boards and compute modules that run a general-purpose operating system (Linux, Windows)"
        },
        "flight_controller": {
          "name": "Flight Controllers",
          "description": "Controller boards for drones and aircraft: MCU, IMU and barometer with ports for ESCs, receivers, video and GNSS, running flight firmware (Betaflight, ArduPilot, PX4, INAV)",
          "agent_notes": "Motor outputs, UART assignments and pad voltages are firmware and board-revision specific; take them from the board's own pinout diagram and firmware target, not from a sibling board."
        },
        "arduino": {
          "name": "Arduino",
          "description": "Arduino boards and compatible boards in Arduino form factors",
          "docs_url": "https://docs.arduino.cc/",
          "agent_notes": "5 V logic on classic AVR boards (Uno, Mega, Nano); 3.3 V on R4 Minima/WiFi, Due and Nano 33 families. Check board voltage before pairing with 3.3 V-only sensors."
        },
        "raspberry_pi": {
          "name": "Raspberry Pi",
          "description": "Raspberry Pi single-board computers, Pico boards and RP-series chips",
          "docs_url": "https://www.raspberrypi.com/documentation/",
          "agent_notes": "All Raspberry Pi GPIO is 3.3 V and not 5 V tolerant. Pico exposes 3.3 V GPIO with 3 ADC channels."
        },
        "esp32": {
          "name": "ESP32",
          "description": "Espressif ESP32 and ESP8266 chips, modules and boards",
          "docs_url": "https://docs.espressif.com/projects/esp-idf/en/latest/esp32/",
          "links": [
            {
              "label": "Arduino-ESP32 core",
              "url": "https://docs.espressif.com/projects/arduino-esp32/en/latest/"
            }
          ],
          "agent_notes": "3.3 V logic, not 5 V tolerant. On classic ESP32, GPIO34-39 are input-only with no pull-ups; GPIO0/2/12/15 are strapping pins; ADC2 is unavailable while Wi-Fi is active."
        },
        "teensy": {
          "name": "Teensy",
          "description": "PJRC Teensy development boards",
          "docs_url": "https://www.pjrc.com/teensy/"
        },
        "adafruit_mcu": {
          "name": "Adafruit MCU",
          "description": "Adafruit Feather, Metro, QT Py and other MCU boards",
          "docs_url": "https://learn.adafruit.com/"
        },
        "seeed_mcu": {
          "name": "Seeed Studio MCU",
          "description": "Seeed Studio XIAO and other MCU boards",
          "docs_url": "https://wiki.seeedstudio.com/"
        }
      }
    },
    "sensor": {
      "name": "Sensors",
      "description": "Sensor chips and sensor modules",
      "children": {
        "environmental": {
          "name": "Environmental",
          "description": "Temperature, humidity, pressure and air quality sensors"
        },
        "distance": {
          "name": "Distance",
          "description": "Ultrasonic, LiDAR, time-of-flight and other distance and proximity sensors"
        },
        "motion": {
          "name": "Motion",
          "description": "IMUs, accelerometers, gyroscopes and motion detection sensors"
        },
        "magnetic": {
          "name": "Magnetic",
          "description": "Magnetometers, compasses and Hall-effect sensors"
        },
        "gnss": {
          "name": "GNSS",
          "description": "Satellite navigation receivers and modules (GPS, Galileo, GLONASS, BeiDou), often combined with a compass"
        },
        "gas": {
          "name": "Gas",
          "description": "Gas detection and air quality sensors"
        },
        "biometric": {
          "name": "Biometric",
          "description": "Heart rate, SpO2 and other biometric sensors"
        },
        "thermal": {
          "name": "Thermal/IR",
          "description": "Thermal imaging and infrared sensors"
        },
        "touch": {
          "name": "Touch",
          "description": "Touch and capacitive sensors"
        },
        "force": {
          "name": "Force and Strain",
          "description": "Load cells, force-sensitive resistors and strain gauges"
        },
        "encoder": {
          "name": "Encoders",
          "description": "Rotary and linear position encoders"
        },
        "color": {
          "name": "Color and Light",
          "description": "Color sensors and ambient light sensors"
        },
        "camera": {
          "name": "Cameras",
          "description": "Camera modules and vision sensors (CSI, DVP and FPC camera modules, smart cameras)"
        }
      }
    },
    "actuator": {
      "name": "Actuators",
      "description": "Motors, motor controllers and other actuators",
      "children": {
        "motor": {
          "name": "Motors",
          "description": "Electric motors of all types",
          "children": {
            "dc_motor": {
              "name": "DC Motors",
              "description": "Brushed DC motors and gearmotors"
            },
            "stepper": {
              "name": "Stepper Motors",
              "description": "Stepper motors and hybrid steppers"
            },
            "servo": {
              "name": "Servo Motors",
              "description": "Servo motors for position control"
            },
            "brushless": {
              "name": "Brushless Motors",
              "description": "Brushless DC motors (BLDC), inrunners and outrunners"
            }
          }
        },
        "motor_controller": {
          "name": "Motor Controllers",
          "description": "Motor drivers and controllers: H-bridges, stepper drives, ESCs and smart motor controllers"
        },
        "servo_controller": {
          "name": "Servo Controllers",
          "description": "PWM servo controllers and drivers"
        },
        "linear_actuator": {
          "name": "Linear Actuators",
          "description": "Linear motion actuators: electric, pneumatic and hydraulic cylinders"
        },
        "solenoid": {
          "name": "Solenoids",
          "description": "Solenoids and electromagnets"
        },
        "haptic": {
          "name": "Haptics",
          "description": "Vibration motors (ERM, LRA) and haptic drivers"
        }
      }
    },
    "power": {
      "name": "Power",
      "description": "Power supplies, batteries and power management",
      "children": {
        "battery": {
          "name": "Batteries",
          "description": "Batteries and battery packs"
        },
        "regulator": {
          "name": "Voltage Regulators",
          "description": "Linear and switching voltage regulators"
        },
        "charger": {
          "name": "Battery Chargers",
          "description": "Battery charging circuits and chargers"
        },
        "monitor": {
          "name": "Power Monitors",
          "description": "Battery fuel gauges and current, voltage and power monitors"
        },
        "pmic": {
          "name": "Power Management IC",
          "description": "Power management integrated circuits"
        },
        "distribution": {
          "name": "Power Distribution",